{
  "$schema": "https://gaspwiki.com/schemas/gasp-adapter-v1.json",
  "version": "1.1",
  "organization": "GASP fixture",
  "warehouse": "postgres",
  "_instructions": "Generated by test/fixture/generate.ts --adapter. Do not edit by hand.",
  "metricOwners": [
    {
      "metric": "All Core Metrics",
      "team": "Finance"
    }
  ],
  "datasets": {
    "customer": "gasp_customers",
    "subscription": "gasp_subscriptions",
    "revenue_event": "gasp_revenue_events",
    "cost_event": "gasp_cost_events",
    "financials": "gasp_financials",
    "opportunity": "gasp_opportunities",
    "lead": "gasp_leads",
    "user": "gasp_users",
    "product_event": "gasp_product_events",
    "survey_response": "gasp_survey_responses",
    "ticket": "gasp_tickets",
    "contract_event": "gasp_contract_events",
    "amendment_event": "gasp_amendment_events",
    "employee": "gasp_employees",
    "requisition": "gasp_requisitions",
    "partner": "gasp_partners",
    "deal_registration": "gasp_deal_registrations",
    "partner_activity": "gasp_partner_activities",
    "project": "gasp_projects",
    "project_milestone": "gasp_project_milestones",
    "deliverable": "gasp_deliverables",
    "consultant": "gasp_consultant_capacity",
    "time_entry": "gasp_time_entries",
    "onboarding": "gasp_onboardings",
    "onboarding_milestone": "gasp_onboarding_milestones",
    "onboarding_session": "gasp_onboarding_sessions",
    "invoice": "gasp_invoices",
    "balance_sheet": "gasp_balance_sheet",
    "revenue_schedule": "gasp_revenue_schedule",
    "forecast": "gasp_forecasts",
    "quote": "gasp_quotes",
    "order": "gasp_orders",
    "incident": "gasp_incidents",
    "deployment": "gasp_deployments",
    "vulnerability": "gasp_vulnerabilities",
    "service_metrics": "gasp_service_metrics",
    "issue": "gasp_issues",
    "feature": "gasp_features",
    "release": "gasp_releases",
    "roadmap_item": "gasp_roadmap_items",
    "campaign": "gasp_campaigns",
    "sales_rep": "gasp_sales_reps",
    "kb_article": "gasp_kb_articles",
    "web_traffic": "gasp_web_traffic",
    "brand_mention": "gasp_brand_mentions",
    "crm_record": "gasp_crm_records",
    "contact": "gasp_contacts",
    "plan": "gasp_plans",
    "product": "gasp_products",
    "license": "gasp_licenses",
    "lifecycle_event": "gasp_lifecycle_events"
  },
  "mappings": [
    {
      "gaspField": "accounts_receivable",
      "warehouseRef": "gasp_balance_sheet.accounts_receivable"
    },
    {
      "gaspField": "acknowledged_at",
      "warehouseRef": "gasp_incidents.acknowledged_at"
    },
    {
      "gaspField": "acquisition_date",
      "warehouseRef": "gasp_customers.acquisition_date"
    },
    {
      "gaspField": "activation_date",
      "dataset": "customer",
      "warehouseRef": "gasp_customers.activation_date"
    },
    {
      "gaspField": "activation_date",
      "dataset": "user",
      "warehouseRef": "gasp_users.activation_date"
    },
    {
      "gaspField": "activity_date",
      "warehouseRef": "gasp_partner_activities.activity_date"
    },
    {
      "gaspField": "activity_id",
      "warehouseRef": "gasp_partner_activities.activity_id"
    },
    {
      "gaspField": "actual_date",
      "dataset": "feature",
      "warehouseRef": "gasp_features.actual_date"
    },
    {
      "gaspField": "actual_date",
      "dataset": "project_milestone",
      "warehouseRef": "gasp_project_milestones.actual_date"
    },
    {
      "gaspField": "actual_revenue",
      "warehouseRef": "gasp_forecasts.actual_revenue"
    },
    {
      "gaspField": "acv",
      "warehouseRef": "gasp_contract_events.acv"
    },
    {
      "gaspField": "ad_spend",
      "warehouseRef": "gasp_campaigns.ad_spend"
    },
    {
      "gaspField": "advanced_to_next_stage",
      "warehouseRef": "gasp_opportunities.advanced_to_next_stage"
    },
    {
      "gaspField": "agent_id",
      "warehouseRef": "gasp_tickets.agent_id"
    },
    {
      "gaspField": "amendment_type",
      "warehouseRef": "gasp_amendment_events.amendment_type"
    },
    {
      "gaspField": "article_id",
      "warehouseRef": "gasp_kb_articles.article_id"
    },
    {
      "gaspField": "attendees",
      "warehouseRef": "gasp_onboarding_sessions.attendees"
    },
    {
      "gaspField": "auto_renewed",
      "warehouseRef": "gasp_subscriptions.auto_renewed"
    },
    {
      "gaspField": "available_hours",
      "warehouseRef": "gasp_consultant_capacity.available_hours"
    },
    {
      "gaspField": "bad_debt_expense",
      "warehouseRef": "gasp_financials.bad_debt_expense"
    },
    {
      "gaspField": "billed_amount",
      "warehouseRef": "gasp_revenue_schedule.billed_amount"
    },
    {
      "gaspField": "billed_hours",
      "warehouseRef": "gasp_time_entries.billed_hours"
    },
    {
      "gaspField": "billed_revenue",
      "warehouseRef": "gasp_time_entries.billed_revenue"
    },
    {
      "gaspField": "billing_trigger_date",
      "warehouseRef": "gasp_invoices.billing_trigger_date"
    },
    {
      "gaspField": "campaign_id",
      "warehouseRef": "gasp_campaigns.campaign_id"
    },
    {
      "gaspField": "capital_expenditures",
      "warehouseRef": "gasp_financials.capital_expenditures"
    },
    {
      "gaspField": "cash_balance",
      "warehouseRef": "gasp_balance_sheet.cash_balance"
    },
    {
      "gaspField": "certification_status",
      "warehouseRef": "gasp_partners.certification_status"
    },
    {
      "gaspField": "ces_score",
      "warehouseRef": "gasp_survey_responses.ces_score"
    },
    {
      "gaspField": "change_nature",
      "dataset": "revenue_event",
      "warehouseRef": "gasp_revenue_events.change_nature"
    },
    {
      "gaspField": "change_nature",
      "dataset": "amendment_event",
      "warehouseRef": "gasp_amendment_events.change_nature"
    },
    {
      "gaspField": "channel",
      "dataset": "campaign",
      "warehouseRef": "gasp_campaigns.channel"
    },
    {
      "gaspField": "channel",
      "dataset": "opportunity",
      "warehouseRef": "gasp_opportunities.channel"
    },
    {
      "gaspField": "close_date",
      "dataset": "opportunity",
      "warehouseRef": "gasp_opportunities.close_date"
    },
    {
      "gaspField": "close_date",
      "dataset": "deal_registration",
      "warehouseRef": "gasp_deal_registrations.closed_on"
    },
    {
      "gaspField": "close_date",
      "dataset": "project",
      "warehouseRef": "gasp_projects.deal_closed_on"
    },
    {
      "gaspField": "close_date_valid",
      "warehouseRef": "gasp_opportunities.close_date_valid"
    },
    {
      "gaspField": "closed_revenue",
      "warehouseRef": "gasp_sales_reps.closed_revenue"
    },
    {
      "gaspField": "committed_at",
      "warehouseRef": "gasp_deployments.committed_at"
    },
    {
      "gaspField": "composite_score",
      "warehouseRef": "gasp_customers.composite_score"
    },
    {
      "gaspField": "consultant_id",
      "dataset": "consultant",
      "warehouseRef": "gasp_consultant_capacity.consultant_id"
    },
    {
      "gaspField": "consultant_id",
      "dataset": "time_entry",
      "warehouseRef": "gasp_time_entries.consultant_id"
    },
    {
      "gaspField": "consultant_id",
      "dataset": "project",
      "warehouseRef": "gasp_projects.consultant_id"
    },
    {
      "gaspField": "contract_end",
      "dataset": "contract_event",
      "warehouseRef": "gasp_contract_events.contract_end"
    },
    {
      "gaspField": "contract_end",
      "dataset": "subscription",
      "warehouseRef": "gasp_subscriptions.contract_end"
    },
    {
      "gaspField": "contract_event_type",
      "warehouseRef": "gasp_contract_events.contract_event_type"
    },
    {
      "gaspField": "contract_start",
      "dataset": "contract_event",
      "warehouseRef": "gasp_contract_events.contract_start"
    },
    {
      "gaspField": "contract_start",
      "dataset": "subscription",
      "warehouseRef": "gasp_subscriptions.contract_start"
    },
    {
      "gaspField": "contract_start",
      "dataset": "onboarding",
      "warehouseRef": "gasp_onboardings.contract_began"
    },
    {
      "gaspField": "contract_start",
      "dataset": "onboarding_milestone",
      "warehouseRef": "gasp_onboarding_milestones.contract_start"
    },
    {
      "gaspField": "core_features_adopted",
      "warehouseRef": "gasp_users.core_features_adopted"
    },
    {
      "gaspField": "cost",
      "warehouseRef": "gasp_cost_events.cost"
    },
    {
      "gaspField": "cost_centre",
      "warehouseRef": "gasp_cost_events.cost_centre"
    },
    {
      "gaspField": "cost_function",
      "warehouseRef": "gasp_cost_events.cost_function"
    },
    {
      "gaspField": "cost_type",
      "warehouseRef": "gasp_cost_events.cost_type"
    },
    {
      "gaspField": "created_at",
      "dataset": "ticket",
      "warehouseRef": "gasp_tickets.created_at"
    },
    {
      "gaspField": "created_at",
      "dataset": "issue",
      "warehouseRef": "gasp_issues.created_at"
    },
    {
      "gaspField": "credit_memo_count",
      "warehouseRef": "gasp_invoices.credit_memo_count"
    },
    {
      "gaspField": "criteria_met",
      "warehouseRef": "gasp_customers.criteria_met"
    },
    {
      "gaspField": "csm_id",
      "warehouseRef": "gasp_customers.csm_id"
    },
    {
      "gaspField": "currency",
      "dataset": "revenue_event",
      "warehouseRef": "gasp_revenue_events.currency"
    },
    {
      "gaspField": "currency",
      "dataset": "cost_event",
      "warehouseRef": "gasp_cost_events.currency"
    },
    {
      "gaspField": "currency",
      "dataset": "contract_event",
      "warehouseRef": "gasp_contract_events.currency"
    },
    {
      "gaspField": "currency",
      "dataset": "invoice",
      "warehouseRef": "gasp_invoices.currency"
    },
    {
      "gaspField": "customer_id",
      "dataset": "revenue_event",
      "warehouseRef": "gasp_revenue_events.account_ref"
    },
    {